{
  "trip_id": "11111111-1111-4111-8111-111111111111",
  "version": 1,
  "title": "Tokyo 7-day demo trip",
  "description": "Example canonical trip for MCP clients.",
  "start_date": "2026-10-20",
  "end_date": "2026-10-26",
  "status": "planned",
  "travelers": [
    {
      "traveler_id": "owner",
      "display_name": "Demo Traveler",
      "role": "owner"
    }
  ],
  "preferences": {
    "pace": "balanced",
    "interests": ["food", "photography", "shopping"],
    "preferred_transport": ["transit", "walking"]
  },
  "place_ids": [
    "22222222-2222-4222-8222-222222222222",
    "33333333-3333-4333-8333-333333333333"
  ],
  "reservation_ids": ["44444444-4444-4444-8444-444444444444"],
  "constraint_ids": [
    "55555555-5555-4555-8555-555555555555",
    "66666666-6666-4666-8666-666666666666"
  ],
  "days": [
    {
      "date": "2026-10-20",
      "items": [
        {
          "item_id": "77777777-7777-4777-8777-777777777777",
          "type": "reservation",
          "reservation_id": "44444444-4444-4444-8444-444444444444",
          "title": "TPE → NRT",
          "start_at": "2026-10-20T07:20:00+08:00",
          "end_at": "2026-10-20T11:35:00+09:00",
          "locked": true
        },
        {
          "item_id": "88888888-8888-4888-8888-888888888888",
          "type": "place",
          "place_id": "33333333-3333-4333-8333-333333333333",
          "title": "Senso-ji",
          "start_at": "2026-10-20T15:00:00+09:00",
          "end_at": "2026-10-20T16:30:00+09:00",
          "duration_minutes": 90,
          "locked": false
        }
      ]
    }
  ],
  "change_proposal_ids": [],
  "created_at": "2026-09-17T00:00:00Z",
  "updated_at": "2026-09-17T00:00:00Z"
}
